{
  "id": "run",
  "label": "Running",
  "tags": [
    "moving"
  ],
  "framing": "full",
  "props": [],
  "text": "running with bent arms and one knee lifted",
  "keypoints": {
    "format": "openpose-body18",
    "canvas": [
      768,
      1152
    ],
    "points": [
      [
        384,
        140
      ],
      [
        384,
        240
      ],
      [
        260,
        285
      ],
      [
        185,
        470
      ],
      [
        280,
        360
      ],
      [
        508,
        285
      ],
      [
        580,
        380
      ],
      [
        525,
        535
      ],
      [
        312,
        600
      ],
      [
        200,
        805
      ],
      [
        110,
        1050
      ],
      [
        456,
        600
      ],
      [
        550,
        680
      ],
      [
        475,
        860
      ],
      [
        355,
        130
      ],
      [
        413,
        130
      ],
      [
        332,
        147
      ],
      [
        436,
        147
      ]
    ]
  },
  "version": 1
}
